{
  "pack_id": "CP_0042",
  "origin": {"trigger": "observatory_click", "node": "visual_naturalize", "diagnosis": ["CONFUSION_HIGH", "GOLD_LOW"]},
  "strategy": ["C_CONFUSION", "B_HUMAN_EVIDENCE"],
  "target_edges": [{"from_true": "visual_naturalize", "to_predicted": "text_naturalize"}],
  "items": 20,
  "difficulty_curve": "medium_to_hard",
  "persona_mix": ["PC_1", "PC_3", "PC_4", "PC_6", "PC_7"],
  "delivery_modes": ["choose_right_meaning", "correction_drill"],
  "expected_yield": {"human_evidence": 20, "contrast_pairs": 12}
}
